{
  "schema_version": "1.0",
  "controlled_runtime_activation_implementation_contract_id": "controlled-runtime-activation-implementation-contract-001",
  "controlled_runtime_activation_implementation_plan_id": "controlled-runtime-activation-implementation-plan-001",
  "controlled_runtime_activation_dry_run_result_id": "controlled-runtime-activation-dry-run-result-001",
  "render_plan_id": "render-plan-001",
  "project_id": "video-orchestrator",
  "platform": "youtube",
  "created_at": "2026-05-13T00:00:00.000Z",
  "implementation_contract_state": "approved_for_future_implementation_dry_run_review",
  "required_artifacts": { "controlled_runtime_activation_implementation_plan_validated": true, "controlled_runtime_activation_dry_run_result_validated": true },
  "implementation_contract_scope": { "artifact_only": true, "future_next_phase_requested": true, "real_upload_enabled_now": false, "upload_execution_enabled_now": false, "network_calls_enabled_now": false, "platform_api_calls_enabled_now": false, "credential_access_enabled_now": false, "media_read_enabled_now": false, "dependencies_requested": false, "package_metadata_changes_requested": false },
  "implementation_contracts": [
    { "contract_id": "contract-kill-switch", "contract_kind": "kill_switch", "safe_summary": "Contract kill switch only.", "implemented_now": false },
    { "contract_id": "contract-single-upload", "contract_kind": "single_upload_limit", "safe_summary": "Contract single upload limit only.", "implemented_now": false },
    { "contract_id": "contract-credential", "contract_kind": "credential_boundary", "safe_summary": "Contract credential boundary only.", "implemented_now": false },
    { "contract_id": "contract-network", "contract_kind": "network_boundary", "safe_summary": "Contract network boundary only.", "implemented_now": false },
    { "contract_id": "contract-media", "contract_kind": "media_boundary", "safe_summary": "Contract media boundary only.", "implemented_now": false }
  ],
  "execution_boundary": { "ready_for_real_upload": false, "real_upload_enabled": false, "runtime_enabled": false, "runtime_executed": false, "upload_allowed": false, "upload_execution_enabled": false, "platform_api_calls_allowed": false, "network_calls_allowed": false, "credentials_accessed": false, "token_accessed": false, "keychain_accessed": false, "env_accessed": false, "media_file_read": false, "file_mutation_allowed": false, "dependencies_added": false, "package_metadata_changed": false },
  "validation": { "complete": true, "ready_for_next_phase": true, "ready_for_real_upload": false, "real_upload_enabled": false, "upload_allowed": false, "network_calls_allowed": false, "platform_api_calls_allowed": false, "credentials_accessed": false, "media_file_read": false, "blocking_reasons": [], "warnings": [] },
  "provenance": { "generated_by": "createControlledRuntimeActivationImplementationContract", "source_controlled_runtime_activation_implementation_plan_id": "controlled-runtime-activation-implementation-plan-001", "source_render_plan_id": "render-plan-001" }
}
